{
  "$schema": "http://json-schema.org/draft-07/schema#",
  "title": "DrawAuditTrailResponse",
  "type": "object",
  "required": [
    "credit_line_id",
    "draw_amount",
    "draw_denom",
    "draw_id",
    "drawn_at",
    "drawn_by",
    "events",
    "repaid"
  ],
  "properties": {
    "credit_line_id": {
      "type": "integer",
      "format": "uint64",
      "minimum": 0.0
    },
    "draw_amount": {
      "type": "string"
    },
    "draw_denom": {
      "type": "string"
    },
    "draw_id": {
      "type": "integer",
      "format": "uint64",
      "minimum": 0.0
    },
    "drawn_at": {
      "$ref": "#/definitions/Timestamp"
    },
    "drawn_by": {
      "$ref": "#/definitions/Addr"
    },
    "events": {
      "type": "array",
      "items": {
        "$ref": "#/definitions/DrawAuditEvent"
      }
    },
    "repaid": {
      "type": "boolean"
    }
  },
  "additionalProperties": false,
  "definitions": {
    "Addr": {
      "description": "A human readable address.\n\nIn Cosmos, this is typically bech32 encoded. But for multi-chain smart contracts no assumptions should be made other than being UTF-8 encoded and of reasonable length.\n\nThis type represents a validated address. It can be created in the following ways 1. Use `Addr::unchecked(input)` 2. Use `let checked: Addr = deps.api.addr_validate(input)?` 3. Use `let checked: Addr = deps.api.addr_humanize(canonical_addr)?` 4. Deserialize from JSON. This must only be done from JSON that was validated before such as a contract's state. `Addr` must not be used in messages sent by the user because this would result in unvalidated instances.\n\nThis type is immutable. If you really need to mutate it (Really? Are you sure?), create a mutable copy using `let mut mutable = Addr::to_string()` and operate on that `String` instance.",
      "type": "string"
    },
    "DrawAction": {
      "description": "The type of action recorded in a draw audit entry.",
      "type": "string",
      "enum": [
        "draw_created",
        "repaid",
        "liquidated",
        "memo_added"
      ]
    },
    "DrawAuditEvent": {
      "description": "A human-readable audit event returned by queries.",
      "type": "object",
      "required": [
        "action",
        "block_height",
        "by",
        "memo",
        "seq",
        "timestamp"
      ],
      "properties": {
        "action": {
          "$ref": "#/definitions/DrawAction"
        },
        "block_height": {
          "type": "integer",
          "format": "uint64",
          "minimum": 0.0
        },
        "by": {
          "$ref": "#/definitions/Addr"
        },
        "memo": {
          "type": "string"
        },
        "seq": {
          "type": "integer",
          "format": "uint64",
          "minimum": 0.0
        },
        "timestamp": {
          "$ref": "#/definitions/Timestamp"
        }
      },
      "additionalProperties": false
    },
    "Timestamp": {
      "description": "A point in time in nanosecond precision.\n\nThis type can represent times from 1970-01-01T00:00:00Z to 2554-07-21T23:34:33Z.\n\n## Examples\n\n``` # use cosmwasm_std::Timestamp; let ts = Timestamp::from_nanos(1_000_000_202); assert_eq!(ts.nanos(), 1_000_000_202); assert_eq!(ts.seconds(), 1); assert_eq!(ts.subsec_nanos(), 202);\n\nlet ts = ts.plus_seconds(2); assert_eq!(ts.nanos(), 3_000_000_202); assert_eq!(ts.seconds(), 3); assert_eq!(ts.subsec_nanos(), 202); ```",
      "allOf": [
        {
          "$ref": "#/definitions/Uint64"
        }
      ]
    },
    "Uint64": {
      "description": "A thin wrapper around u64 that is using strings for JSON encoding/decoding, such that the full u64 range can be used for clients that convert JSON numbers to floats, like JavaScript and jq.\n\n# Examples\n\nUse `from` to create instances of this and `u64` to get the value out:\n\n``` # use cosmwasm_std::Uint64; let a = Uint64::from(42u64); assert_eq!(a.u64(), 42);\n\nlet b = Uint64::from(70u32); assert_eq!(b.u64(), 70); ```",
      "type": "string"
    }
  }
}
